{
  "$schema": "schemas/v0.4-test-cases.schema.json",
  "manifest_schema_version": "1.0.0",
  "suite": "v0.4",
  "release": {
    "id": "v0.4"
  },
  "profile": {
    "id": "dssc-building-energy-metadata-v0.4"
  },
  "shape_artifact": {
    "assertion_id": "shape-v04-metadata-shapes",
    "artifact_id": "v04-metadata-shapes",
    "path": "C_Semantic_Treehouse/model/v0.4/data-product-metadata-shapes.ttl",
    "sha256": "a556039c0ec3030a9c4273c62a787e448b8869f7648e948663e10d3fe007cbda"
  },
  "engine": {
    "name": "pySHACL",
    "version": "0.40.1",
    "inference": "none",
    "advanced": true,
    "abort_on_first": false,
    "meta_shacl": true,
    "allow_warnings": false,
    "allow_infos": false,
    "do_owl_imports": false
  },
  "evidence_refs": {
    "meta_shacl": {
      "assertion_id": "evidence-v04-meta-shacl",
      "kind": "META_SHACL",
      "path": "C_Semantic_Treehouse/evidence/releases/v0.4/model/v0.4-model-host.result.json",
      "sha256": "77d062ec2a5e9feb307629deeff23ff52841c12d0f93cf84843d4eae7fbd03a3"
    },
    "shape_structure": {
      "assertion_id": "evidence-v04-shape-structure",
      "kind": "SHAPE_STRUCTURE",
      "path": "C_Semantic_Treehouse/evidence/releases/v0.4/model/v0.4-model-host.result.json",
      "sha256": "77d062ec2a5e9feb307629deeff23ff52841c12d0f93cf84843d4eae7fbd03a3"
    }
  },
  "cases": [
    {
      "case_id": "D04-PC001",
      "fixture": {
        "assertion_id": "fixture-d04-pc001",
        "path": "C_Semantic_Treehouse/fixtures/v0.4/pass/D04-PC001-valid-one-dataset-iri-baseline.jsonld",
        "format": "json-ld",
        "sha256": "d6bc8c4d626a6db08adbead1a12e3d02e390feead75c265bf164c33800fd87da"
      },
      "release_id": "v0.4",
      "profile_id": "dssc-building-energy-metadata-v0.4",
      "shape_artifact_assertion_id": "shape-v04-metadata-shapes",
      "requirement_ids": [
        "D04-R001",
        "D04-R002",
        "D04-R003",
        "D04-R004",
        "D04-R005",
        "D04-R006",
        "D04-R007",
        "D04-R008",
        "D04-R009",
        "D04-R010",
        "D04-R011",
        "D04-R012",
        "D04-R013",
        "D04-R014",
        "D04-R015",
        "D04-R016",
        "D04-R017"
      ],
      "decision_ids": [
        "ADR-001",
        "ADR-002",
        "ADR-003"
      ],
      "expected_business_status": "PASS",
      "oracle": {
        "expected_target_activation_minimum": 1,
        "result_count": {
          "exact": 0
        }
      }
    },
    {
      "case_id": "D04-PC002",
      "fixture": {
        "assertion_id": "fixture-d04-pc002",
        "path": "C_Semantic_Treehouse/fixtures/v0.4/fail/D04-PC002-zero-dataset-nodes.jsonld",
        "format": "json-ld",
        "sha256": "992af8fb570a3319a5cbbb8b6c57564e62905b6b62d25b7f196ba183a7cd2a5b"
      },
      "release_id": "v0.4",
      "profile_id": "dssc-building-energy-metadata-v0.4",
      "shape_artifact_assertion_id": "shape-v04-metadata-shapes",
      "requirement_ids": [
        "D04-R001"
      ],
      "decision_ids": [
        "ADR-002",
        "ADR-003"
      ],
      "expected_business_status": "FAIL",
      "oracle": {
        "expected_target_activation_minimum": 1,
        "result_count": {
          "exact": 1
        },
        "expected_results": [
          {
            "assertion_id": "result-d04-pc002-01",
            "requirement_id": "D04-R001",
            "source_shape": "ex:DatasetCardinalityShape",
            "source_constraint_component": "sh:SPARQLConstraintComponent",
            "severity": "sh:Violation",
            "message": {
              "policy": "EXACT",
              "value": "The submitted RDF graph must contain exactly one dcat:Dataset. Found 0 or more than 1."
            },
            "count": {
              "exact": 1
            }
          }
        ]
      }
    },
    {
      "case_id": "D04-PC003",
      "fixture": {
        "assertion_id": "fixture-d04-pc003",
        "path": "C_Semantic_Treehouse/fixtures/v0.4/fail/D04-PC003-two-dataset-nodes.jsonld",
        "format": "json-ld",
        "sha256": "dcf14124812891810270003f0474ef27b74d7fba96ca27f365bd32bce85dcb99"
      },
      "release_id": "v0.4",
      "profile_id": "dssc-building-energy-metadata-v0.4",
      "shape_artifact_assertion_id": "shape-v04-metadata-shapes",
      "requirement_ids": [
        "D04-R001"
      ],
      "decision_ids": [
        "ADR-002",
        "ADR-003"
      ],
      "expected_business_status": "FAIL",
      "oracle": {
        "expected_target_activation_minimum": 1,
        "result_count": {
          "exact": 1
        },
        "expected_results": [
          {
            "assertion_id": "result-d04-pc003-01",
            "requirement_id": "D04-R001",
            "source_shape": "ex:DatasetCardinalityShape",
            "source_constraint_component": "sh:SPARQLConstraintComponent",
            "severity": "sh:Violation",
            "message": {
              "policy": "EXACT",
              "value": "The submitted RDF graph must contain exactly one dcat:Dataset. Found 0 or more than 1."
            },
            "count": {
              "exact": 1
            }
          }
        ]
      }
    },
    {
      "case_id": "D04-PC004",
      "fixture": {
        "assertion_id": "fixture-d04-pc004",
        "path": "C_Semantic_Treehouse/fixtures/v0.4/fail/D04-PC004-blank-node-dataset.jsonld",
        "format": "json-ld",
        "sha256": "1417beb873467ec19d85c3acc4f0e558c8f686f9d59ebd2b0f4008e86bdd45ad"
      },
      "release_id": "v0.4",
      "profile_id": "dssc-building-energy-metadata-v0.4",
      "shape_artifact_assertion_id": "shape-v04-metadata-shapes",
      "requirement_ids": [
        "D04-R002"
      ],
      "decision_ids": [
        "ADR-002",
        "ADR-003"
      ],
      "expected_business_status": "FAIL",
      "oracle": {
        "expected_target_activation_minimum": 1,
        "result_count": {
          "exact": 1
        },
        "expected_results": [
          {
            "assertion_id": "result-d04-pc004-01",
            "requirement_id": "D04-R002",
            "source_shape": "ex:BuildingEnergyDatasetShape",
            "source_constraint_component": "sh:NodeKindConstraintComponent",
            "severity": "sh:Violation",
            "message": {
              "policy": "PRESENT"
            },
            "count": {
              "exact": 1
            }
          }
        ]
      }
    },
    {
      "case_id": "D04-PC005",
      "fixture": {
        "assertion_id": "fixture-d04-pc005",
        "path": "C_Semantic_Treehouse/fixtures/v0.4/fail/D04-PC005-dataset-id-missing.jsonld",
        "format": "json-ld",
        "sha256": "0bd3b5d9e9cc301e27f908cd055b76fd47e1c971057e5795aa7ee3096d980b9f"
      },
      "release_id": "v0.4",
      "profile_id": "dssc-building-energy-metadata-v0.4",
      "shape_artifact_assertion_id": "shape-v04-metadata-shapes",
      "requirement_ids": [
        "D04-R003"
      ],
      "decision_ids": [
        "ADR-002",
        "ADR-003"
      ],
      "expected_business_status": "FAIL",
      "oracle": {
        "expected_target_activation_minimum": 1,
        "result_count": {
          "exact": 1
        },
        "expected_results": [
          {
            "assertion_id": "result-d04-pc005-01",
            "requirement_id": "D04-R003",
            "source_shape": "ex:DatasetIdShape",
            "source_constraint_component": "sh:MinCountConstraintComponent",
            "severity": "sh:Violation",
            "message": {
              "policy": "EXACT",
              "value": "ex:datasetId is required and must be one non-blank xsd:string."
            },
            "count": {
              "exact": 1
            },
            "result_path": "ex:datasetId"
          }
        ]
      }
    },
    {
      "case_id": "D04-PC006",
      "fixture": {
        "assertion_id": "fixture-d04-pc006",
        "path": "C_Semantic_Treehouse/fixtures/v0.4/fail/D04-PC006-dataset-id-multi-valued.jsonld",
        "format": "json-ld",
        "sha256": "4d84548792b490a3841015dc7d7a57023fab7621694d89fe28e6b73e4def820b"
      },
      "release_id": "v0.4",
      "profile_id": "dssc-building-energy-metadata-v0.4",
      "shape_artifact_assertion_id": "shape-v04-metadata-shapes",
      "requirement_ids": [
        "D04-R003"
      ],
      "decision_ids": [
        "ADR-002",
        "ADR-003"
      ],
      "expected_business_status": "FAIL",
      "oracle": {
        "expected_target_activation_minimum": 1,
        "result_count": {
          "exact": 1
        },
        "expected_results": [
          {
            "assertion_id": "result-d04-pc006-01",
            "requirement_id": "D04-R003",
            "source_shape": "ex:DatasetIdShape",
            "source_constraint_component": "sh:MaxCountConstraintComponent",
            "severity": "sh:Violation",
            "message": {
              "policy": "EXACT",
              "value": "ex:datasetId is required and must be one non-blank xsd:string."
            },
            "count": {
              "exact": 1
            },
            "result_path": "ex:datasetId"
          }
        ]
      }
    },
    {
      "case_id": "D04-PC007",
      "fixture": {
        "assertion_id": "fixture-d04-pc007",
        "path": "C_Semantic_Treehouse/fixtures/v0.4/fail/D04-PC007-dataset-id-non-string.jsonld",
        "format": "json-ld",
        "sha256": "1e0d7adc70ff67de682667abc820252610ed7f4fec5886f8b7b3c9f62c6f1cea"
      },
      "release_id": "v0.4",
      "profile_id": "dssc-building-energy-metadata-v0.4",
      "shape_artifact_assertion_id": "shape-v04-metadata-shapes",
      "requirement_ids": [
        "D04-R003"
      ],
      "decision_ids": [
        "ADR-002",
        "ADR-003"
      ],
      "expected_business_status": "FAIL",
      "oracle": {
        "expected_target_activation_minimum": 1,
        "result_count": {
          "exact": 1
        },
        "expected_results": [
          {